{
  "project_name": "technical-change-skill",
  "created": "2026-04-03T16:00:00-04:00",
  "updated": "2026-04-06T00:00:00-04:00",
  "next_tc_number": 8,
  "records": [
    {
      "tc_id": "TC-001-04-03-26-initial-skill-implementation",
      "title": "Initial TC Skill Implementation",
      "status": "tested",
      "scope": "feature",
      "priority": "high",
      "created": "2026-04-03T16:00:00-04:00",
      "updated": "2026-04-03T16:00:00-04:00",
      "path": "records/TC-001-04-03-26-initial-skill-implementation",
      "sub_tc_count": 5,
      "test_summary": { "total": 4, "pass": 4, "fail": 0, "pending": 0, "skip": 0, "blocked": 0 }
    },
    {
      "tc_id": "TC-002-04-03-26-first-use-auto-detect",
      "title": "First-Use Auto-Detection and Global Skill",
      "status": "implemented",
      "scope": "enhancement",
      "priority": "high",
      "created": "2026-04-03T17:15:00-04:00",
      "updated": "2026-04-03T17:15:00-04:00",
      "path": "records/TC-002-04-03-26-first-use-auto-detect",
      "sub_tc_count": 0,
      "test_summary": { "total": 2, "pass": 2, "fail": 0, "pending": 0, "skip": 0, "blocked": 0 }
    },
    {
      "tc_id": "TC-003-04-05-26-demo-screenshot-readme",
      "title": "Demo Screenshot and Hero Image for README",
      "status": "implemented",
      "scope": "documentation",
      "priority": "medium",
      "created": "2026-04-05T21:30:00-04:00",
      "updated": "2026-04-05T21:30:00-04:00",
      "path": "records/TC-003-04-05-26-demo-screenshot-readme",
      "sub_tc_count": 0,
      "test_summary": { "total": 0, "pass": 0, "fail": 0, "pending": 0, "skip": 0, "blocked": 0 }
    },
    {
      "tc_id": "TC-004-04-05-26-npm-package",
      "title": "npm Package — npx tc-skill",
      "status": "implemented",
      "scope": "infrastructure",
      "priority": "high",
      "created": "2026-04-05T21:30:00-04:00",
      "updated": "2026-04-05T21:30:00-04:00",
      "path": "records/TC-004-04-05-26-npm-package",
      "sub_tc_count": 0,
      "test_summary": { "total": 0, "pass": 0, "fail": 0, "pending": 0, "skip": 0, "blocked": 0 }
    },
    {
      "tc_id": "TC-005-04-05-26-retro-from-git",
      "title": "/tc retro --from-git Auto-Mode",
      "status": "implemented",
      "scope": "feature",
      "priority": "high",
      "created": "2026-04-05T21:30:00-04:00",
      "updated": "2026-04-05T21:30:00-04:00",
      "path": "records/TC-005-04-05-26-retro-from-git",
      "sub_tc_count": 0,
      "test_summary": { "total": 0, "pass": 0, "fail": 0, "pending": 0, "skip": 0, "blocked": 0 }
    },
    {
      "tc_id": "TC-006-04-05-26-cross-agent-compat",
      "title": "Cross-Agent Compatibility (Cursor, Codex, Gemini CLI)",
      "status": "implemented",
      "scope": "enhancement",
      "priority": "medium",
      "created": "2026-04-05T21:30:00-04:00",
      "updated": "2026-04-05T21:30:00-04:00",
      "path": "records/TC-006-04-05-26-cross-agent-compat",
      "sub_tc_count": 0,
      "test_summary": { "total": 0, "pass": 0, "fail": 0, "pending": 0, "skip": 0, "blocked": 0 }
    },
    {
      "tc_id": "TC-007-04-06-26-self-reflection-add-claude-md",
      "title": "Self-Reflection: Add CLAUDE.md Project Instructions",
      "status": "planned",
      "scope": "documentation",
      "priority": "medium",
      "created": "2026-04-06T00:00:00-04:00",
      "updated": "2026-04-06T00:00:00-04:00",
      "path": "records/TC-007-04-06-26-self-reflection-add-claude-md",
      "sub_tc_count": 0,
      "test_summary": { "total": 0, "pass": 0, "fail": 0, "pending": 0, "skip": 0, "blocked": 0 }
    }
  ],
  "statistics": {
    "total": 7,
    "by_status": { "planned": 1, "in_progress": 0, "blocked": 0, "implemented": 5, "tested": 1, "deployed": 0 },
    "by_scope": { "feature": 2, "bugfix": 0, "refactor": 0, "infrastructure": 1, "documentation": 2, "hotfix": 0, "enhancement": 2 },
    "by_priority": { "critical": 0, "high": 4, "medium": 3, "low": 0 }
  }
}
